date,time,handle,display_name,follower_count,content_type,action_taken,comment_text,post_url,notes
2026-02-09,21:30,@turn.studio,the cozy lofi,unknown,pottery/ceramics,follow+like+comment,"the random color combos on these are so fun, love that you're leaning into it",https://www.instagram.com/p/DUYgwfmlNmO/,rainbow stencil mug design. great engagement. uses mayco glazes and nabertherm kiln
2026-02-09,21:32,@zoegrenaudier,Jean Ferrat,unknown,pottery/ceramics,follow+like,,https://www.instagram.com/p/DSnJhFzDP8E/,french ceramicist. large thrown vases. beautiful earthenware
2026-02-09,21:34,@izzy_home_designs,Izzy Designer & Artist,762,home design/handmade,follow+like,,https://www.instagram.com/p/DRB9tdmEibX/,sydney based textile designer and UGC creator. adjacent lifestyle audience
2026-02-09,21:36,@livingkiln,livingkiln,unknown,pottery/ceramics,follow+like,,https://www.instagram.com/p/DSSst45ARg5/,verified. whimsical functional ceramics (berry strainers). small biz. very genuine caption style
2026-02-09,21:38,@lucky_rabbit_co,lucky_rabbit_co,unknown,pottery/ceramics,follow+like+comment,"that progress in under a year is wild, the vessel at the end is so clean",https://www.instagram.com/p/DS5r_V1EbpZ/,pottery progress post. very genuine and personal. good community engagement
